{
  "schema_version": "0.6",
  "usage_event_id": "uev_gateway_01JZ8Q8V",
  "occurred_at": "2026-07-28T05:58:20.000Z",
  "observed_at": "2026-07-28T05:58:21.000Z",
  "received_at": "2026-07-28T05:58:21.050Z",
  "delegation_id": "del_abc123",
  "client_id": "app_natureguard",
  "beneficiary_ref": "ben_pairwise_91",
  "sponsorship_program_id": "program_green_earth_2026",
  "consent_receipt_id": "cr_natureguard_2026_01",
  "request_id": "req_88",
  "run_id": "run_abc",
  "attempt_id": "att_88_1",
  "reservation_id": "res_88",
  "trace_id": "4bf92f3577b34da6a3ce929d0e0e4736",
  "span_id": "00f067aa0ba902b7",
  "sequence_scope": "reservation",
  "sequence_number": 1,
  "operation": "ai.generate.text",
  "provider": "gateway.example",
  "route_provider": "provider.example",
  "requested_model": "economy-text",
  "resolved_model": "economy-text",
  "routing_reason": "primary",
  "retry_count": 0,
  "outcome": "completed",
  "latency_ms": 1700,
  "usage_dimensions": [
    {"type": "input_tokens", "quantity": 1240, "unit": "token"},
    {"type": "output_tokens", "quantity": 300, "unit": "token"}
  ],
  "usage_measurements": {
    "estimated": [{"type": "provider_ai_unit", "quantity": 3.2, "unit": "unit"}],
    "gateway_observed": [{"type": "provider_ai_unit", "quantity": 2.5, "unit": "unit"}]
  },
  "billing": {
    "unit_type": "provider_ai_unit",
    "estimated_quantity": 3.2,
    "reserved_quantity": 5,
    "settled_quantity": 2.5,
    "funding_source_type": "sponsor_budget",
    "funding_bucket_ref": "bucket_pairwise_7f2",
    "price_snapshot_id": "price_2026_07_standard_text"
  },
  "evidence": {
    "class": "gateway_attested",
    "status": "provisional",
    "issuer": "https://gateway.example",
    "provider_request_id": "prov_req_782",
    "attested_at": "2026-07-28T05:58:21.050Z"
  },
  "reconciliation": {"status": "pending"},
  "client_attribution": {
    "workspace_ref": "ws_pseudo_42",
    "feature_ref": "feature_report_draft",
    "workflow_ref": "workflow_incident_triage",
    "workload_ref": "workload_public_report",
    "agent_run_ref": "run_abc",
    "agent_step_ref": "step_04"
  }
}
